id,activity,title,creator,assignee,status,type,message_count
26686,2016-08-10.22:57:36,email.parser stops parsing headers too soon when given a defective message.,2507,None,1,5,7.0
12290,2016-08-10.17:32:01,__setstate__ is called for false values,13918,12260,1,None,5.0
27724,2016-08-10.13:52:48,PEP3119 inconsintent with actual CPython impl,24396,12260,1,None,2.0
27718,2016-08-09.13:47:09,help('signal') incomplete (e.g: signal.signal not visible),24390,12260,1,5,2.0
27693,2016-08-09.07:31:03,curses.textpad.Textbox(win).edit() won't edit last character,24369,None,1,5,3.0
27709,2016-08-08.21:47:15,difflib.HtmlDiff produces different output from difflib.ndiff,10753,None,1,5,2.0
18049,2016-08-07.09:38:51,Re-enable threading test on OSX,925,925,1,5,5.0
27696,2016-08-06.07:35:18,win_add2path.py does not add user site directory,24373,None,1,5,1.0
24844,2016-08-04.17:36:18,Python 3.5rc1 compilation error with Apple clang 4.2 included with Xcode 4,11758,None,1,2,7.0
27681,2016-08-04.11:50:43,readline: consecutive rl_kill_word do not append,24363,None,1,None,3.0
27679,2016-08-04.08:32:36,set_bitfields() unused in _ctypes_test,14751,None,1,None,1.0
5404,2016-08-03.23:06:44,Cross-compiling Python,10167,None,1,2,16.0
18334,2016-08-03.15:12:05,"type(name, bases, dict) does not call metaclass' __prepare__ attribute",10693,12260,1,5,5.0
1005895,2016-08-03.03:22:13,curses for win32,3529,None,1,6,16.0
24214,2016-08-02.18:53:51,UTF-8 incremental decoder doesn't support surrogatepass correctly,18890,None,1,5,4.0
27655,2016-08-02.07:12:50,[Patch] Don't require presence of POLLPRI,22884,None,1,None,5.0
19660,2016-08-01.04:29:45,decorator syntax: allow testlist instead of just dotted_name,18627,None,1,6,18.0
27658,2016-07-31.01:31:19,python 3.5.2 built from source fails to install completely on Mac OS X 10.11.6. Crashes subsequently.,24343,None,1,1,5.0
27653,2016-07-30.10:50:24,[Patch] Also disable the use of <netinet/tcp.h> on CloudABI,22884,None,1,None,1.0
27623,2016-07-30.01:21:55,int.to_bytes() and int.from_bytes(): raise ValueError when bytes count is zero,13573,None,1,5,14.0
27605,2016-07-29.17:56:25,Inconsistent calls to __eq__ from built-in __contains__,18032,None,1,5,5.0
17600,2016-07-29.04:55:11,mingw: build-in windows modules (winreg),9108,None,1,6,2.0
27646,2016-07-28.18:30:50,yield from expression can be any iterable,155,12260,1,5,1.0
26852,2016-07-28.16:05:00,add the '--enable-sourceless-distribution' option to configure,12652,None,1,6,17.0
27637,2016-07-28.12:47:31,"int.to_bytes(-1, ...) should automatically choose required count of bytes",13573,None,1,6,6.0
27590,2016-07-28.06:42:54,tarfile module next() method hides exceptions,24292,None,1,5,9.0
17605,2016-07-28.05:51:52,mingw-meta: build interpeter core,9108,None,1,6,4.0
16353,2016-07-27.07:37:47,add function to os module for getting path to default shell,12075,None,1,6,49.0
17594,2016-07-27.07:33:32,mingw: preset configure defaults,9108,None,1,6,3.0
18500,2016-07-27.06:18:28,mingw: detect winsock2 and setup _socket module,9108,None,1,6,2.0
27346,2016-07-26.19:31:02,Implement os.readv() / os.writev() in Windows port,13573,None,1,6,4.0
27628,2016-07-26.19:00:54,ipaddress incompatibility with ipaddr: __contains__ between networks,12704,None,1,5,3.0
26226,2016-07-26.17:21:15,Test failures with non-ascii character in hostname on Windows,21927,None,1,5,17.0
27612,2016-07-26.16:06:22,socket.gethostbyname resolving octal IP addresses incorrectly,24310,None,1,5,19.0
20948,2016-07-26.09:47:38,-Wformat=2 -Wformat-security findings,19220,None,1,None,9.0
17238,2016-07-26.08:53:30,IDLE: Add import statement completion,14620,None,1,6,6.0
11190,2016-07-25.15:37:45,test_locale error on AIX,2630,None,1,None,4.0
11193,2016-07-25.15:16:07,test_subprocess error on AIX,2630,None,1,5,9.0
18766,2016-07-25.02:42:32,IDLE: Autocomplete in editor doesn't work for un-imported modules,17830,None,1,6,7.0
15303,2016-07-24.11:04:03,Minor revision to the <BaseWidget._setup> method in Tkinter,16255,15623,1,6,4.0
27226,2016-07-24.10:50:15,distutils: unable to compile both .opt-1.pyc and .opt2.pyc simultaneously,13113,None,1,6,7.0
27582,2016-07-24.08:30:51,Mispositioned SyntaxError caret for unknown code points,1309,None,1,5,11.0
18181,2016-07-24.07:56:54,PEP447: Add type.__getdescriptor__,925,None,1,5,27.0
734176,2016-07-24.05:32:35,Make Tkinter.py's nametowidget work with cloned menu widgets,1717,None,1,5,12.0
27602,2016-07-24.04:02:58,Enable py launcher to launch repository Python.,155,None,1,6,7.0
27597,2016-07-23.10:58:09,"Add usage examples for TracebackException, StackSummary and FrameSummary",11519,12260,1,6,1.0
27547,2016-07-22.20:47:35,Crash or freeze trying to execute b'a' * 0xFFFFFFFFFFFFFFF,23559,None,1,None,3.0
27561,2016-07-22.20:18:17,"Warn against subclassing builtins, and overriding their methods",24282,114,1,6,9.0
27580,2016-07-21.22:12:58,CSV Null Byte Error,24294,None,1,6,9.0
27562,2016-07-21.16:21:12,Import error encodings (Windows xp compatibility),24281,None,1,6,8.0
27578,2016-07-21.13:44:17,inspect.findsource raises exception with empty __init__.py,22926,None,1,5,5.0
26859,2016-07-21.13:31:21,"unittest fails with ""Start directory is not importable"" when trying to run sourceless tests",12652,None,1,5,7.0
3559,2016-07-21.00:55:49,IDLE: Pasted newline doesn't trigger execution when typed newline would,155,155,1,5,10.0
13376,2016-07-20.14:15:39,readline: pre_input_hook not getting called,15119,925,1,5,5.0
20932,2016-07-20.13:27:29,Undefined behavior flagged by Clang 3.4 (Python 3.5 from hg),19220,None,1,2,8.0
14903,2016-07-20.12:21:40,dictobject infinite loop in module set-up,16049,None,1,5,12.0
14375,2016-07-19.01:17:48,Add socketserver running property,3080,None,1,6,4.0
27540,2016-07-17.19:39:25,msvcrt.ungetwch() calls _ungetch(),43,None,1,5,3.0
27419,2016-07-17.11:20:46,Bugs in PyImport_ImportModuleLevelObject,15623,None,1,1,8.0
22246,2016-07-16.21:25:36,"add strptime(s, '%s')",12270,1427,1,6,3.0
27530,2016-07-16.17:05:44,Non-Critical Compiler WARNING: Python Embedding C++11 does not allow non-constant string literals,24270,None,1,2,1.0
27526,2016-07-16.02:09:05,test_venv.TestEnsurePip fails mysteriously when /tmp is too small,9663,None,1,5,1.0
10225,2016-07-16.01:27:06,Fix doctest runable examples in python manual,1427,None,1,None,21.0
27521,2016-07-15.19:30:35,Misleading compress level header on files created with gzip,24265,None,1,5,3.0
27501,2016-07-14.20:47:15,Add typing.py class describing a PEP 3118 buffer object,24249,None,1,6,7.0
27513,2016-07-14.16:56:41,email.utils.getaddresses does not handle Header objects,5724,None,1,1,3.0
18858,2016-07-14.14:49:37,dummy_threading lacks threading.get_ident() equivalent,9827,14674,1,5,5.0
25733,2016-07-14.12:35:59,Code and IDLE should catch all compile errors.,19901,155,1,5,10.0
27509,2016-07-14.08:41:55,Some tests breaks PGO build on Windows,24257,None,1,2,6.0
27133,2016-07-13.03:19:46,python 3.5.1 will not compile because libffi module uses wrong CFLAGS,23993,None,1,2,5.0
22981,2016-07-13.03:16:56,Use CFLAGS when extracting multiarch,2040,None,1,6,2.0
19027,2016-07-13.02:55:17,undefined symbol: _PyParser_Grammar,43,None,1,2,4.0
27499,2016-07-12.18:00:43,PY_SSIZE_T_CLEAN conflicts with Py_LIMITED_API,11735,None,1,None,4.0
27496,2016-07-12.17:30:10,unicodedata.name() doesn't have names for control characters,16955,None,1,5,4.0
27491,2016-07-12.05:26:59,Errors when building with UNICODE character set,15976,None,1,2,1.0
26608,2016-07-12.00:31:52,RLock undocumented behavior in case of multiple acquire,23641,12260,1,None,3.0
8027,2016-07-11.21:41:47,distutils fail to determine c++ linker with unixcompiler if using ccache,11934,None,1,2,19.0
27486,2016-07-11.18:49:00,FTPlib hangs on some pasv responses,24240,None,1,6,1.0
27464,2016-07-11.18:07:32,Document that SplitResult & friends are namedtuples,16282,114,1,None,2.0
27483,2016-07-11.17:52:09,Expose HEAD_LOCK/HEAD_UNLOCK in pystate.c,13220,None,1,6,3.0
27274,2016-07-10.18:10:35,[ctypes] Allow from_pointer creation,10194,None,1,6,8.0
17213,2016-07-09.13:47:04,"ctypes loads wrong version of C runtime, leading to error message box from system",17298,None,1,5,9.0
27139,2016-07-07.16:52:32,Increased test coverage for statistics.median_grouped,23997,None,1,5,6.0
25077,2016-07-06.19:12:22,Compiler warnings: initialization from incompatible pointer type,697,None,1,2,4.0
26292,2016-07-05.04:04:18,Raw I/O writelines() broken for non-blocking I/O,2377,None,1,None,7.0
27451,2016-07-04.21:50:28,gzip.py: Please save more of the gzip header for later examination,2941,None,1,6,1.0
27447,2016-07-04.17:12:00,python -m doctest script_file_with_no_py_extension produces confusing NameErrors,20274,None,1,5,3.0
12806,2016-07-04.14:03:28,argparse: Hybrid help text formatter,14759,None,1,6,19.0
24959,2016-07-04.11:29:32,unittest swallows part of stack trace when raising AssertionError in a TestCase,12075,None,1,5,7.0
27429,2016-07-03.14:17:00,xml.sax.saxutils.escape doesn't escape multiple characters safely,24197,12260,1,6,5.0
27081,2016-07-03.04:25:20,Cannot capture sys.stderr output from an uncaught exception in a multiprocessing Process using a multiprocessing Queue,19901,None,1,5,7.0
26903,2016-07-02.20:22:58,ProcessPoolExecutor(max_workers=64) crashes on Windows,23856,None,1,5,4.0
27436,2016-07-01.19:51:55,Strange code in selectors.KqueueSelector,11758,None,1,6,8.0
27432,2016-07-01.13:52:20,Unittest truncating of error message not works,24201,None,1,6,2.0
27423,2016-07-01.05:27:58,Failed assertions when running test.test_os on Windows,21927,None,1,1,5.0
26665,2016-07-01.00:37:12,pip is not bootstrapped by default on 2.7,23684,12260,1,6,2.0
16142,2016-06-30.18:50:07,ArgumentParser inconsistent with parse_known_args,14746,None,1,5,9.0
26894,2016-06-30.17:19:57,Readline not aborting line edition on sigint,10194,None,1,5,3.0
23794,2016-06-30.12:49:00,http package should support HTTP/2,9612,None,1,6,11.0
27420,2016-06-30.10:33:36,Docs for os.link - say what happens if link already exists,24193,12260,1,6,1.0
27409,2016-06-29.02:54:56,"List socket.SO_*, SCM_*, MSG_*, IPPROTO_* symbols",14751,12260,1,None,1.0
27408,2016-06-29.02:22:03,Document importlib.abc.ExecutionLoader implements get_data(),37,12260,1,None,1.0
27387,2016-06-27.18:21:39,Thread hangs on str.encode() when locale is not set,17866,12260,1,5,6.0
22079,2016-06-27.02:21:28,Ensure in PyType_Ready() that base class of static type is static,15623,15623,1,6,20.0
24364,2016-06-25.21:03:42,Not all defects pass through email policy,9663,None,1,5,6.0
27353,2016-06-25.11:36:37,Add nroot function to math,9511,None,1,6,9.0
27351,2016-06-24.21:47:53,Unexpected ConfigParser.read() behavior when passed fileobject,15561,12704,1,5,6.0
27344,2016-06-24.17:29:11,zipfile *does* support utf-8 filenames,11735,12260,1,None,11.0
18391,2016-06-24.17:22:46,socket.fromfd()'s API is difficult or impossible to use correctly in general,18103,None,1,6,8.0
27198,2016-06-24.16:44:00,Adding an assertClose() method to unittest.TestCase,21878,None,1,6,19.0
22455,2016-06-24.15:33:11,idna/punycode give wrong results on narrow builds,12829,None,1,None,2.0
21106,2016-06-24.14:52:17,Updated Mac folder icon,19328,5248,1,6,15.0
27379,2016-06-24.03:19:57,SocketType changed in Python 3,14751,None,1,None,1.0
26537,2016-06-24.02:42:43,"ConfigParser has optionxform, but not sectionxform",23579,12704,1,6,4.0
13344,2016-06-24.02:20:45,closed sockets don't raise EBADF anymore,2040,None,1,5,3.0
22228,2016-06-23.00:50:47,Adapt bash readline operate-and-get-next function,20043,None,1,6,12.0
27196,2016-06-22.21:47:44,Eliminate 'ThemeChanged' warning when running IDLE tests,155,155,1,5,6.0
27152,2016-06-22.14:03:21,Additional assert methods for unittest,15623,None,1,6,10.0
10116,2016-06-21.13:44:38,Sporadic failures in test_urllibnet,352,1741,1,5,14.0
26990,2016-06-21.13:21:28,file.tell affect decoding,23899,None,1,None,2.0
27201,2016-06-21.12:43:11,expose the ABI name as a config variable,169,None,1,None,2.0
14826,2016-06-21.12:36:36,urlopen URL with unescaped space,4448,1741,1,6,21.0
15730,2016-06-21.09:25:33,Silence unused value warnings under Mac OS X 10.8/clang,11731,925,1,6,4.0
25259,2016-06-21.09:23:25,readline macros can segfault Python,2751,None,1,1,4.0
26090,2016-06-21.07:22:59,More correct string truncating in PyUnicode_FromFormat(),15623,None,1,6,5.0
1690201,2016-06-21.06:24:07,Added support for custom readline functions,3781,None,1,6,10.0
17507,2016-06-21.04:26:23,To add history time format in readline,17529,None,1,6,4.0
24727,2016-06-21.04:23:10,Wrap rl_forced_update_display() and lock readline module while active,22195,None,1,6,4.0
12186,2016-06-21.03:50:02,readline.replace_history_item still leaks memory,11968,None,1,3,3.0
1606233,2016-06-21.03:10:57,readline on popen3 file returns empty string before end,4671,None,1,5,3.0
12833,2016-06-21.02:10:31,Document the need to pass the prompt to raw_input() with readline,14746,12260,1,5,11.0
27328,2016-06-20.08:49:57,Documentation corrections for email defects,14751,None,1,None,2.0
22214,2016-06-20.03:25:20,Tkinter: Don't stringify callback arguments,15623,15623,1,6,7.0
25602,2016-06-19.19:48:27,Add support for EVFILT_USER kqueue filter,22841,None,1,6,4.0
27302,2016-06-18.20:00:27,csv.Sniffer guesses wrong when unquoted fields contain quotes,15590,None,1,5,2.0
24424,2016-06-18.15:21:46,xml.dom.minidom: performance issue with Node.insertBefore(),21967,15623,1,7,13.0
27258,2016-06-18.14:29:48,Exception in BytesGenerator.flatten,5724,None,1,None,7.0
27149,2016-06-18.09:16:04,Implement socket.sendmsg() for Windows,13573,None,1,6,5.0
27341,2016-06-18.04:37:56,mock.patch decorating a generator returns a regular function.,24128,None,1,5,6.0
18373,2016-06-17.14:20:20,let code force str(bytes) to raise an exception,11735,None,1,6,20.0
15243,2016-06-17.11:04:37,Misleading documentation for __prepare__,16169,12260,1,5,9.0
23360,2016-06-17.10:50:56,Content-Type when sending data with urlopen(),14751,12260,1,None,7.0
27307,2016-06-17.09:56:51,string.Formatter does not support key/attribute access on unnumbered fields,24038,None,1,5,1.0
27273,2016-06-17.09:22:51,"subprocess.run(cmd, input='text') should pass universal_newlines=True to Popen",12270,None,1,6,1.0
18751,2016-06-17.08:55:16,A manager's server never joins its threads,2040,None,1,5,4.0
14562,2016-06-17.01:52:49,urllib2 maybe blocks too long with small chunks,15808,1741,1,5,6.0
27335,2016-06-16.23:58:04,Clarify that writing to locals() inside a class body is supported,9511,12260,1,None,2.0
27334,2016-06-16.17:13:01,pysqlite3 context manager not performing rollback when a database is locked elsewhere for non-DML statements,24125,None,1,5,2.0
27256,2016-06-16.15:33:50,email header indentation destroyed,5724,None,1,5,3.0
27257,2016-06-16.15:33:06,get_addresses results in traceback with an addrspec with an empty local part.,5724,None,1,5,6.0
27165,2016-06-16.07:27:46,Skip callables when displaying exception fields in cgitb,13179,None,1,6,2.0
26836,2016-06-16.06:00:59,Add memfd_create to os module,3108,None,1,6,2.0
27329,2016-06-16.04:48:22,Document behavior when CDLL is called  with None as an argument on POSIX systems,24123,12260,1,6,1.0
27320,2016-06-16.02:09:32,./setup.py --help-commands should sort extra commands,16370,None,1,None,2.0
27326,2016-06-15.10:26:36,SIGSEV in test_window_funcs of test_curses,12652,None,1,1,1.0
26582,2016-06-15.08:34:18,asyncio documentation links to wrong CancelledError,23614,12260,1,6,6.0
27123,2016-06-14.17:38:58,Allow `install_headers` command to follow specific directory structure,17666,None,1,6,4.0
27317,2016-06-14.11:49:30,Handling data_files: too much is removed in uninstall,17666,None,1,5,1.0
27315,2016-06-14.07:47:39,pydoc: prefer the pager command in favor of the specifc less command,169,None,1,None,3.0
27263,2016-06-14.01:11:29,"Tkinter sets the HOME environment variable, breaking scripts",24077,12260,1,5,13.0
26262,2016-06-13.20:31:54,Cannot compile with /fp:strict with MSVC,15467,None,1,2,2.0
19570,2016-06-13.19:15:17,distutils' Command.ensure_dirname fails on Unicode,18602,None,1,5,5.0
25413,2016-06-13.07:31:33,ctypes (libffi) fails to compile on Solaris X86,21351,None,1,2,3.0
27303,2016-06-13.03:56:17,[argparse] Unify options in help output,10194,None,1,6,4.0
25476,2016-06-13.02:14:53,close() behavior on non-blocking BufferedIO objects with sockets,11758,None,3,5,6.0
27024,2016-06-13.00:12:12,IDLE shutdown glitch when started by import,155,None,1,5,6.0
12623,2016-06-12.20:34:36,"""universal newlines"" subprocess support broken with select- and poll-based communicate()",2040,None,1,5,17.0
4821,2016-06-12.11:22:32,Patches for thread-support in built-in SHA modules,9817,None,1,7,6.0
26835,2016-06-12.11:22:18,Add file-sealing ops to fcntl,3108,None,1,6,1.0
15649,2016-06-12.07:35:03,subprocess.Popen.communicate: accept str for input parameter if universal_newlines is False,10303,None,1,6,6.0
26565,2016-06-11.20:10:02,[ctypes] Add value attribute to non basic pointers.,10194,None,1,6,5.0
24107,2016-06-11.13:29:40,Add support for retrieving the certificate chain,18753,None,1,6,3.0
26545,2016-06-10.11:56:12,os.walk is limited by python's recursion limit,17551,12260,1,None,5.0
27281,2016-06-09.20:30:57,unpickling an xmlrpc.client.Fault raises TypeError,24095,None,1,5,7.0
16132,2016-06-09.08:38:35,ctypes incorrectly encodes .format attribute of memory views,11758,None,1,5,3.0
26955,2016-06-09.04:17:51,Implement equivalent to `pip.locations.distutils_scheme` in distutils,17666,None,1,6,6.0
27260,2016-06-08.17:40:29,Missing equality check for super objects,22444,22444,1,6,4.0
27261,2016-06-08.13:41:11,io.BytesIO.truncate does not work as advertised,24076,None,1,5,4.0
13451,2016-06-08.05:08:52,sched.py: speedup cancel() method,3080,114,1,7,19.0
27259,2016-06-07.19:55:04,Possible missing deprecation warnings?,4041,12260,1,6,1.0
23496,2016-06-07.17:47:40,Steps for Android Native Build of Python 3.4.2,20853,None,1,6,176.0
21130,2016-06-07.16:08:41,equivalent functools.partial instances should compare equal,66,None,1,6,17.0
7949,2016-06-07.01:56:28,IDLE: problems with dark GTK or KDE color schemes,4240,155,1,5,9.0
27101,2016-06-06.16:09:37,Compilation of python (modules) for foreign target platform problem.,23969,None,1,2,9.0
17004,2016-06-06.12:58:29,Expand zipimport to include other compression methods,114,None,1,6,10.0
23883,2016-06-06.02:30:54,__all__ lists are incomplete,15623,None,1,6,62.0
24790,2016-06-06.02:11:18,Idle: improve stack viewer,155,155,1,5,24.0
17598,2016-06-06.01:23:52,mingw: init system calls,9108,None,1,6,2.0
26329,2016-06-05.22:23:42,"os.path.normpath(""//"") returns //",23402,None,1,5,8.0
27219,2016-06-05.16:18:41,turtle.fillcolor doesn't accept a tuple of floats,22444,22444,1,6,3.0
18083,2016-06-05.00:00:15,_sysconfigdata.py is installed in an arch-independent directory,13729,None,1,None,3.0
27218,2016-06-04.17:35:52,improve tracing performance with f_trace set to Py_None,12652,None,1,6,1.0
25804,2016-06-04.16:58:23,Make Profile.print_stats support sorting by mutiple values,20244,None,1,6,4.0
26779,2016-06-04.06:56:50,pdb continue followed by an exception in the same frame shows incorrect frame linenumber,23520,None,1,5,4.0
24238,2016-06-04.06:48:58,Avoid entity expansion attacks in Element Tree,14751,None,1,4,2.0
25812,2016-06-04.00:13:38,locale.nl_langinfo() can't decode value,15623,None,1,5,3.0
27197,2016-06-03.21:04:32,"mock.patch interactions with ""from"" imports",24054,None,1,5,2.0
27145,2016-06-03.14:44:40,long_add and long_sub might return a new int where &small_ints[x] could be returned,23216,None,1,5,3.0
20408,2016-06-03.09:11:04,memoryview() constructor documentation error,2731,12260,1,5,7.0
5150,2016-06-03.06:41:54,IDLE to support reindent.py,114,None,1,6,14.0
27195,2016-06-03.05:03:46,Crash when RawIOBase.write(b) evaluates b.format,14751,None,1,1,1.0
23061,2016-06-03.00:47:47,Update pep8 to specify explicitly 'module level' imports at top of file,20550,12260,1,6,6.0
25702,2016-06-03.00:27:51,Link Time Optimizations support for GCC and CLANG,22319,None,1,7,45.0
26589,2016-06-02.23:52:11,Add HTTP Response code 451,114,114,1,6,6.0
27189,2016-06-02.22:31:55,configure --with-lto with clang should find the appropriate llvm-profdata tool,252,None,1,2,1.0
21446,2016-06-02.21:07:40,Update reload fixer to use importlib instead of imp,14674,None,1,None,3.0
25160,2016-06-02.19:28:30,Stop using deprecated imp module; imp should now emit a real DeprecationWarning,2377,None,1,6,8.0
13548,2016-06-02.17:06:41,Invalid 'line' tracer event on pass within else clause,473,None,1,5,4.0
18085,2016-06-02.07:43:49,Verifying refcounts.dat,15623,12260,1,5,14.0
13501,2016-06-02.06:31:11,Make libedit support more generic; port readline / libedit to FreeBSD,9509,None,1,6,19.0
9755,2016-06-02.03:03:39,Fix refcounting details in Py3k C API documentation,1309,12260,1,None,3.0
16964,2016-06-02.00:04:05,Add 'm' format specifier for mon_grouping etc.,11089,None,1,6,2.0
27175,2016-06-01.09:21:42,Unpickling Path objects,16370,None,1,5,1.0
22232,2016-06-01.07:27:48,str.splitlines splitting on non-\r\n characters,18482,12260,1,5,26.0
17383,2016-06-01.03:35:09,Possibly ambiguous phrasing in tutorial/modules#more-on-modules,17442,12260,1,5,13.0
27161,2016-05-31.20:53:13,Confusing exception in Path().with_name,16370,None,1,None,11.0
25566,2016-05-30.16:42:20,asyncio reference cycles after ConnectionResetError,22797,None,1,3,3.0
27154,2016-05-29.21:02:52,Regression in file.writelines behavior,2522,None,1,5,4.0
27150,2016-05-29.18:26:37,"PEP446 (CLOEXEC by default) violation with fcntl.fcntl(..., fcntl.F_DUPFD)",13573,12260,1,5,4.0
25592,2016-05-28.23:58:02,distutils docs: data_files always uses sys.prefix,16197,12260,1,5,1.0
7951,2016-05-28.21:14:38,Should str.format allow negative indexes when used for __getitem__ access?,2799,155,1,6,27.0
27132,2016-05-28.18:23:45,New assert method that checks an error message for a list of strings,15774,None,1,6,8.0
27121,2016-05-28.14:09:34,imghdr does not support jpg files with Lavc bytes,23978,None,1,5,1.0
27012,2016-05-26.20:23:02,Rename the posix module to _os,37,None,1,6,3.0
6818,2016-05-25.16:52:08,remove/delete method for zipfile/tarfile objects,5675,None,1,6,33.0
27032,2016-05-25.13:35:17,Remove deprecated html.parser.HTMLParser.unescape(),15623,None,1,6,6.0
27119,2016-05-25.09:11:46,`compile` doesn't compile into an AST object as specified,18930,12260,1,5,3.0
25419,2016-05-25.08:03:01,Readline completion of module names in import statements,14751,None,1,6,6.0
24235,2016-05-25.03:49:34,ABCs don't fail metaclass instantiation,4470,None,1,None,2.0
14196,2016-05-24.18:54:52,Unhandled exceptions in pdb return value display,15591,None,1,None,3.0
27086,2016-05-23.15:06:20,Add closefd argument to os.listdir,12207,None,1,6,4.0
27067,2016-05-22.23:46:04,Improve curses tests,15623,15623,1,6,14.0
27088,2016-05-22.23:39:31,"doc: select: epoll.poll: incorrect timeout units, missing maxevents",23963,12260,1,None,1.0
27084,2016-05-22.22:25:35,Add dir_fd and follow_symlinks kwargs to os.listdir and os.scandir,12207,None,1,6,5.0
18100,2016-05-22.01:42:23,socket.sendall() cannot send buffers of 2GB or more,17935,None,1,5,12.0
27074,2016-05-21.07:45:05,Confusing text about __all__ in __init__.py in tutorial,16731,12260,1,6,1.0
9517,2016-05-20.18:20:34,"Make test.script_helper more comprehensive, and use it in the test suite",2040,None,1,6,55.0
25533,2016-05-20.14:23:24,Make pkgutil.iter_modules() yield built-in modules,14751,None,1,6,11.0
26369,2016-05-20.09:34:40,unicode.decode and str.encode are unnecessarily confusing for non-ascii,23438,12260,1,5,15.0
19695,2016-05-20.09:29:08,Clarify how to use various import-related locks,37,None,1,6,2.0
27062,2016-05-19.20:36:37,`inspect` doesn't have `__all__`,18930,None,1,5,2.0
16468,2016-05-19.16:26:56,argparse only supports iterable choices,12075,None,1,5,26.0
15913,2016-05-19.15:52:53,PyBuffer_SizeFromFormat is missing,16515,None,1,6,2.0
27037,2016-05-19.06:18:55,"Universal newline support for zipFile.ZipExtFile.read() is not working (deprecated?), and the missing functionality not documented",23936,12260,1,5,3.0
26049,2016-05-18.14:01:38,Poor performance when reading large xmlrpc data,23183,None,1,7,16.0
27036,2016-05-18.11:14:52,Mark up of references in different form,15623,12260,1,6,9.0
22377,2016-05-17.16:08:08,%Z in strptime doesn't match EST and others,11519,None,1,5,11.0
27022,2016-05-16.21:50:16,expose sendmmsg() syscall  in sockets API,13573,None,1,6,2.0
25453,2016-05-16.21:29:52,Arithmetics with complex infinities is inconsistent with C/C++,22712,None,1,6,15.0
18531,2016-05-16.07:12:59,Undocumented different between METH_KEYWORDS and **kws,19,12260,1,5,15.0
21199,2016-05-16.06:43:01,Python on 64-bit Windows uses signed 32-bit type for read length,15238,2731,1,5,25.0
27020,2016-05-16.06:10:27,os.writev() does not accept generators (as buffers argument),13573,None,1,5,7.0
1674555,2016-05-16.04:13:21,sys.path in tests contains system directories,3055,None,1,5,19.0
12669,2016-05-16.03:32:56,test_curses skipped on buildbots,4348,None,1,5,10.0
20371,2016-05-15.21:21:40,datetime.datetime.replace bypasses a subclass's __new__,17329,None,1,5,14.0
26870,2016-05-15.16:01:48,Unexpected call to readline's add_history in call_readline,21965,None,1,5,18.0
27016,2016-05-15.15:12:20,BlockingIOError not raised inside function.,23927,None,1,5,4.0
27026,2016-05-15.09:12:15,async/await keywords are missing from reference docs,19640,12260,1,6,2.0
2675,2016-05-15.01:05:47,Curses terminal resize problems when Python is in interactive mode,7252,12260,1,5,6.0
16027,2016-05-14.13:58:00,pkgutil doesn't support frozen modules,4,None,1,None,9.0
