id,activity,title,creator,assignee,status,type,message_count
19476,2014-10-03.22:13:47,"Add a dedicated specification for module ""reloading"" to the language reference",14000,None,1,6,2.0
19453,2014-10-03.22:12:46,"pydoc.py doesn't detect IronPython, help(foo) can hang",18548,None,1,1,2.0
16066,2014-10-03.19:21:50,Truncated POST data in CGI script on Windows 7,16586,None,1,5,4.0
8627,2014-10-03.17:55:41,Unchecked PyErr_WarnPy3k return value in Objects/typeobject.c,1118,None,1,5,19.0
15108,2014-10-03.17:52:13,ERROR: SystemError: ./../Objects/tupleobject.c:118: bad argument to internal function,16175,None,1,5,10.0
17848,2014-10-03.16:16:42,can't compile with clang and build a shared lib due to libffi,17776,None,1,2,3.0
19468,2014-10-03.12:53:40,Relax the type restriction on reloaded modules,14000,None,1,6,3.0
19558,2014-10-03.00:01:25,Provide Tcl/Tk linkage information for extension module builds,5248,None,1,6,2.0
15371,2014-10-02.22:38:37,test_cmd_line_script should include namespace package tests,1309,None,1,None,2.0
16425,2014-10-02.22:31:15,"minidom replaceChild(new_child, old_child) removes new_child even if in another document",16837,None,1,5,2.0
14929,2014-10-02.17:47:46,IDLE crashes on *Edit / Find in files ...* command,16071,155,1,5,9.0
19460,2014-10-02.10:29:03,Add test for MIMENonMultipart,17937,None,1,None,2.0
19402,2014-10-02.10:24:10,AbstractBasicAuthHandler,18527,None,1,5,1.0
18228,2014-10-02.09:53:02,AIX locale parsing failure,17767,None,3,5,5.0
22538,2014-10-02.03:51:11,turtledemo two_canvases reversion,155,155,1,5,1.0
22535,2014-10-02.03:20:00,headerregistry.Address introduces extra quotes without addr_spec parameter,20222,None,1,5,2.0
11646,2014-10-02.00:30:27,2to3: msvcrt.(get|put)ch -> (get|put)wch,2984,None,1,None,2.0
11598,2014-10-01.23:50:57,missing afxres.h error when building bdist_wininst in Visual Studio 2008 Express,5587,None,1,2,6.0
17780,2014-10-01.21:18:16,"the test suite should use a TEMPDIR in the build directory, not the source directory",169,None,1,None,2.0
9274,2014-10-01.20:58:47,code.InteractiveInterpreter fails to change locals when invoked in a function,10612,12260,1,5,8.0
4609,2014-10-01.20:49:17,Allow use of > 256 FD's on solaris in 32 bit mode,4799,None,1,6,4.0
22472,2014-10-01.14:41:07,OSErrors should use str and not repr on paths,9663,None,1,5,10.0
19113,2014-10-01.07:51:26,duplicate test names in Lib/ctypes/test/test_functions.py,12652,None,1,5,3.0
1180267,2014-09-30.23:52:30,expanding platform module and making it work as it should,2265,4,1,6,8.0
2382,2014-09-30.23:24:28,[Py3k] SyntaxError cursor shifted if multibyte character is in line.,2529,None,1,5,28.0
10328,2014-09-30.21:47:20,re.sub[n] doesn't seem to handle /Z replacements correctly in all cases,13252,None,1,5,3.0
7436,2014-09-30.21:12:54,Define 'object with assignable attributes',155,12260,1,None,3.0
18675,2014-09-30.19:27:00,Daemon Threads can seg fault,735,12260,1,None,3.0
8041,2014-09-30.18:39:03,No documentation for Py_TPFLAGS_HAVE_STACKLESS_EXTENSION or Py_TPFLAGS_HAVE_VERSION_TAG.,5251,12260,1,None,4.0
20164,2014-09-30.17:16:21,Undocumented KeyError from os.path.expanduser,15635,None,1,5,5.0
22456,2014-09-30.12:59:10,__base__ undocumented,9138,12260,1,6,5.0
10789,2014-09-29.22:58:16,Lock.acquire documentation is misleading,13541,155,1,None,9.0
9104,2014-09-29.14:23:39,test.support method for dual-testing accelerated code (fixes test_exceptions and other's pickle testing),1427,None,1,6,15.0
809846,2014-09-29.10:17:45,bdist_wininst doesn't clean up read-only files in build dir,1290,4555,1,5,4.0
9912,2014-09-29.10:11:42,Fail when vsvarsall.bat produces stderr,3940,4555,1,6,10.0
8747,2014-09-28.23:31:56,Autoconf tests in python not portably correct,9509,None,1,2,5.0
8988,2014-09-28.23:15:50,import + coding = failure (3.1.2/win32),12511,None,1,5,19.0
9350,2014-09-28.21:54:36,add remove_argument_group to argparse,2074,None,1,6,3.0
1160328,2014-09-28.20:57:09,urllib2 post error when using httpproxy,4616,None,1,5,3.0
9643,2014-09-28.20:50:37,"urllib2 - Basic,Digest Proxy Auth Handlers failure will give 401 code instead of 407",1741,1741,1,5,3.0
1382562,2014-09-28.19:10:42,--install-base not honored on win32,126,8,1,5,3.0
20742,2014-09-28.18:55:56,2to3 zip fixer doesn't fix for loops.,9146,None,1,5,3.0
2148,2014-09-28.17:15:39,nis module not supporting group aliases,5205,8,1,6,5.0
22503,2014-09-28.11:43:22,Signal stack overflow in faulthandler_user,17791,None,1,3,3.0
21329,2014-09-28.02:12:09,configparser can't parse MySQL style config,18269,None,1,6,3.0
11479,2014-09-27.16:38:30,Add discussion of trailing backslash in raw string to tutorial,9663,12260,1,6,8.0
11102,2014-09-27.16:25:50,"configure doesn't find ""major()"" on HP-UX v11.31",11827,None,1,2,6.0
22496,2014-09-27.16:07:41,urllib2 fails against IIS (urllib2 can't parse 401 reply www-authenticate headers),18608,1741,1,1,4.0
15986,2014-09-27.12:51:54,memoryview: expose 'buf' attribute,11089,None,1,6,9.0
13611,2014-09-26.11:38:51,Integrate ElementC14N module into xml.etree package,2153,None,1,6,3.0
8212,2014-09-26.11:32:56,A tp_dealloc of a subclassed class cannot resurrect an object,2217,None,1,6,13.0
16512,2014-09-26.08:12:37,imghdr doesn't recognize variant jpeg formats,16890,None,1,6,13.0
22474,2014-09-26.04:06:45,No explanation of how a task gets destroyed in asyncio 'task' documentation,9663,12260,1,5,2.0
21472,2014-09-25.20:37:19,Fix wsgiref handling of absolute HTTP Request-URI,14250,None,1,5,5.0
22497,2014-09-25.19:08:52,msiexec not creating msvcr90.dll with python -2.7.6.msi,20192,None,1,None,2.0
22491,2014-09-25.11:04:06,Support Unicode line boundaries in regular expression,15623,None,1,6,2.0
21821,2014-09-24.22:50:58,The function cygwinccompiler.is_cygwingcc leads to FileNotFoundError under Windows 7,19786,None,1,5,2.0
22476,2014-09-24.14:50:01,"asyncio task chapter confusion about 'task', 'future', and 'schedule'",9663,12260,1,5,2.0
22433,2014-09-24.01:00:45,Argparse considers unknown optional arguments with spaces as a known positional argument,20164,None,1,5,6.0
1159,2014-09-22.02:44:01,os.getenv() not updated after external module uses C putenv(),4086,12260,1,5,14.0
22425,2014-09-21.09:09:34,2to3 import fixer writes dotted_as_names into import_as_names,18656,None,1,5,1.0
22441,2014-09-20.00:21:54,Not all attributes of the console for a subprocess with creationflags=0 are inherited,12509,None,1,5,2.0
19690,2014-09-18.03:21:06,test_logging test_race failed with PermissionError,5248,None,1,5,7.0
22418,2014-09-16.15:02:28,ipaddress.py new IPv6 Method for Solicited Multicast Address,20153,None,1,6,2.0
22376,2014-09-12.22:38:00,urllib2.urlopen().read().splitlines() opening a directory in a FTP server randomly returns incorrect result,20140,None,1,5,3.0
22355,2014-09-12.21:47:43,inconsistent results with inspect.getsource / .getsourcelines,13159,None,1,5,2.0
22299,2014-09-11.19:50:24,resolve() on Windows makes some pathological paths unusable,19820,None,1,5,27.0
22387,2014-09-11.15:49:10,Making tempfile.NamedTemporaryFile a class,16370,None,1,6,5.0
7744,2014-09-10.13:26:44,Allow site.addsitedir insert to beginning of sys.path,3090,None,1,6,6.0
20752,2014-09-10.07:01:35,Difflib should provide the option of overriding the SequenceMatcher,13206,6,1,6,13.0
20506,2014-09-10.05:41:44,Command to display all available Import Library,18960,None,1,6,7.0
13272,2014-09-09.20:55:39,2to3 fix_renames doesn't rename string.lowercase/uppercase/letters,7047,None,1,5,4.0
22371,2014-09-09.18:04:18,tests failing with -uall and http_proxy and https_proxy set,169,None,1,None,2.0
18232,2014-09-09.09:03:49,running a suite with no tests is not an error,3924,None,1,6,6.0
1525806,2014-09-09.08:55:16,Tkdnd mouse cursor handling patch,2987,8,1,6,3.0
22361,2014-09-09.08:35:47,Ability to join() threads in concurrent.futures.ThreadPoolExecutor,11870,None,1,6,3.0
20071,2014-09-08.11:51:44,What should happen if someone runs ./python -m ensurepip in the build environment?,9663,None,1,None,3.0
21468,2014-09-07.03:47:32,NNTPLib connections become corrupt after long periods of activity,19571,None,1,None,4.0
19280,2014-09-05.23:52:54,Add a datatype to represent mime types to the email module,9663,None,1,6,3.0
900092,2014-09-05.23:09:30,hotshot.stats.load fails with AssertionError,1659,None,1,5,26.0
896330,2014-09-05.19:41:35,pyconfig.h is not placed in --includedir,957,None,1,5,8.0
1152248,2014-09-05.03:09:20,Add support for reading records with arbitrary separators to the standard IO stack,1309,None,1,6,39.0
17083,2014-09-05.02:51:16,can't specify newline string for readline for binary files,17217,None,1,6,9.0
22051,2014-09-03.23:29:57,Turtledemo: stop reloading demos,155,155,1,5,2.0
15237,2014-09-03.07:32:51,Add capsule API to _decimal,11089,11089,1,6,9.0
7946,2014-09-03.06:45:13,Convoy effect with I/O bound threads and New GIL,11758,2040,1,7,83.0
10312,2014-09-02.13:00:41,intcatcher() can deadlock,1440,None,1,5,4.0
17396,2014-09-01.10:28:17,modulefinder fails if module contains syntax error,17458,None,1,5,7.0
4733,2014-09-01.01:34:25,"Add a ""decode to declared encoding"" version of urlopen to urllib",3250,1741,1,6,11.0
22309,2014-08-31.14:22:45,distutils/spawn.py handle fork() not implemented.,18773,None,1,6,4.0
22310,2014-08-31.14:14:33,Report actual EOF character instead of assuming Ctrl-D,18773,None,1,6,4.0
22313,2014-08-31.10:22:00,Make PYLONG_BITS_IN_DIGIT always available to non-core extensions,2153,None,1,6,1.0
6029,2014-08-30.10:52:10,FAIL: test_longdouble (ctypes.test.test_callbacks.Callbacks) [SPARC/64-bit],10545,None,1,5,10.0
1812,2014-08-30.04:25:06,doctest _load_testfile function -- newline handling seems incorrect,4533,None,1,5,29.0
10536,2014-08-30.04:21:17,Enhancements to gettext docs,7641,7641,1,None,4.0
5879,2014-08-29.23:52:32,"multiprocessing example ""pool of http servers "" fails on windows",10470,None,1,5,4.0
22303,2014-08-29.22:24:14,Write better test for SSLContext.load_verify_locations,2040,None,1,6,1.0
4277,2014-08-29.21:55:50,asynchat's handle_error inconsistency,3080,3080,1,5,4.0
22282,2014-08-29.01:33:52,ipaddress module accepts octal formatted IPv4 addresses in IPv6 addresses,20080,None,1,5,2.0
22277,2014-08-28.16:16:58,webbrowser.py add parameters to suppress output on stdout and stderr,20078,None,1,6,10.0
22279,2014-08-27.17:45:18,read() vs read1() in asyncio.StreamReader documentation,20079,None,1,5,8.0
22263,2014-08-26.06:31:09,Add a resource for CLI tests,15623,None,1,6,3.0
12933,2014-08-25.22:58:16,Update or remove claims that distutils requires external programs,7641,7641,1,6,5.0
22213,2014-08-25.19:04:21,Make pyvenv style virtual environments easier to configure when embedding Python,8983,None,1,6,8.0
22260,2014-08-25.18:16:56,"Rearrange tkinter tests, use test discovery",15467,None,1,6,5.0
1483545,2014-08-25.07:32:51,Wave.py support for ulaw and alaw audio,3701,None,1,6,5.0
17180,2014-08-24.08:42:33,shutil copy* unsafe on POSIX - they preserve setuid/setgit bits,11233,None,1,4,14.0
21585,2014-08-23.19:49:02,Run Tkinter tests with wantobjects=False,15623,15623,1,6,11.0
15125,2014-08-23.13:03:01,argparse: positional arguments containing - in name not handled well,16182,12260,1,5,20.0
18374,2014-08-22.10:40:14,ast.parse gives wrong position (col_offset) for some BinOp-s,15069,None,1,5,2.0
18188,2014-08-22.05:38:39,ERROR: test_no_optimize_flag on Mageia Linux Cauldron x86-64 with certain configure flags,17967,None,1,5,9.0
22024,2014-08-22.05:28:57,Add to shutil the ability to wait until files are definitely deleted,15467,None,1,6,7.0
22014,2014-08-20.14:09:13,Improve display of OS exception <-> errno mapping,1309,12260,1,6,8.0
22223,2014-08-20.13:47:19,argparse not including '--' arguments in previous optional REMAINDER argument,13463,None,1,5,2.0
22229,2014-08-20.13:30:32,wsgiref doesn't appear to ever set REMOTE_HOST in the environ,9612,None,1,5,1.0
1742205,2014-08-19.10:05:53,ZipFile.writestr writes incorrect extended local headers,2769,15623,1,5,4.0
21041,2014-08-18.19:17:12,pathlib.PurePath.parents rejects negative indexes,12270,None,1,5,9.0
22195,2014-08-17.23:21:13,Make it easy to replace print() calls with logging calls,2040,None,1,6,11.0
13916,2014-08-17.15:19:53,"disallow the ""surrogatepass"" handler for non utf-* encodings",15417,2377,1,6,20.0
22210,2014-08-16.20:32:07,pdb-run-restarting-a-pdb-session,20046,None,1,5,2.0
20779,2014-08-15.22:32:16,Add pathlib.chown method,17937,None,1,6,4.0
1234674,2014-08-14.05:09:22,"filecmp.cmp's ""shallow"" option",2309,12,1,5,12.0
10608,2014-08-13.14:46:22,Add a section to Windows FAQ explaining os.symlink,10080,10080,1,5,2.0
18381,2014-08-13.14:02:20,unittest warnings counter,3080,9716,1,6,6.0
22171,2014-08-12.17:44:50,stack smash when using ctypes/libffi to access union,20024,None,1,1,3.0
1011113,2014-08-10.21:41:42,Make “install” find the build_base directory,1885,7641,1,5,9.0
2200,2014-08-10.19:54:28,find_executable fails to find .bat files on win32,5293,7641,1,5,17.0
18979,2014-08-08.02:28:58,Use argparse in the uu module,15623,None,1,6,3.0
15907,2014-08-08.00:10:21,move doctest test-data files into a subdirectory of Lib/test,12075,None,1,6,5.0
15428,2014-08-07.23:27:58,"add ""Name Collision"" section to argparse docs",2074,12260,1,6,2.0
14365,2014-08-07.22:47:31,"argparse: subparsers, argument abbreviations and ambiguous option",15685,None,1,5,14.0
18977,2014-08-07.20:27:55,The -t option has no effect in for uu command-line,15623,15623,1,6,2.0
22164,2014-08-07.14:32:39,cell object cleared too early?,2040,None,1,None,1.0
11955,2014-08-04.23:26:11,3.3 : test_argparse.py fails 'make test',14196,None,1,5,9.0
15018,2014-08-04.20:17:05,Incomplete Python LDFLAGS and CPPFLAGS used for extension modules on posix,16113,7641,1,5,2.0
10071,2014-08-04.15:21:07,Should not release GIL while running RegEnumValue,2529,None,1,1,7.0
1371826,2014-08-04.15:05:30,distutils is silent about multiple -I/-L/-R,15,7641,1,6,4.0
21987,2014-08-04.14:07:02,TarFile.getmember on directory requires trailing slash iff over 100 chars,19903,None,1,5,7.0
11445,2014-08-04.03:36:12,python.exe on OS X shared-llbrary build erroneously linked to MacPorts python library,15,5248,1,None,11.0
15992,2014-08-03.20:41:40,Strict aliasing violations in Objects/unicodeobject.c,1118,None,1,5,1.0
17774,2014-08-03.20:38:59,unable to disable -r in run_tests.py,169,None,1,5,1.0
18624,2014-08-03.19:19:09,Add alias for iso-8859-8-i which is the same as iso-8859-8,9663,None,1,6,11.0
13822,2014-08-03.16:37:33,is(upper/lower/title) are not exactly correct,4455,None,1,6,1.0
9665,2014-08-03.08:55:39,"Buid issues on Cygwin - _curses, _curses_panel, and _io",10080,None,1,2,13.0
18631,2014-08-03.07:26:02,mingw: setup msvcrt and _winapi modules,9108,None,1,6,2.0
18495,2014-08-03.06:17:57,mingw: ignore main program for frozen scripts,9108,None,1,6,1.0
17604,2014-08-03.06:14:56,mingw: use main() to start execution,9108,None,1,6,1.0
17148,2014-08-03.06:09:56,mingw: nt thread model detection,9108,None,1,6,2.0
18645,2014-08-03.05:17:32,Add a configure option for performance guided optimization,114,8,1,6,3.0
18611,2014-08-03.00:15:39,Mac: Some Python Launcher issues,925,925,1,5,1.0
1327594,2014-08-01.18:55:31,Static Windows Build fails to locate existing installation,3650,8,1,5,5.0
9529,2014-08-01.14:48:47,Make re match object iterable,10460,None,1,6,12.0
22029,2014-08-01.01:23:53,argparse - CSS white-space: like control for individual text blocks,14858,None,1,6,2.0
18651,2014-07-31.23:19:56,test failures on KFreeBSD,169,None,1,5,5.0
18477,2014-07-30.22:33:11,fix_import (2to3 fixer) is not case-sensitive,13266,None,1,5,2.0
13123,2014-07-30.21:56:08,bdist_wininst uninstaller does not remove pycache directories,301,7641,1,5,11.0
4508,2014-07-30.18:00:26,distutils compiler not handling spaces in path to output/src files,9658,7641,1,5,19.0
1776160,2014-07-30.16:55:20,Buffer overflow when listing deeply nested directory,1439,None,1,5,12.0
10551,2014-07-30.15:43:15,mimetypes read from the registry should not overwrite standard mime mappings,13401,None,1,5,13.0
16100,2014-07-29.23:41:33,Compiling vim with Python 3.3 support fails,16624,None,1,2,5.0
4722,2014-07-29.22:55:55,_winreg.QueryValue fault while reading mangled registry values,9805,None,1,5,7.0
1054,2014-07-29.22:55:03,scriptsinstall target fails in alternate build dir,15,None,1,5,3.0
4198,2014-07-29.21:23:17,os.path.normcase gets fooled on windows with mapped linux network drive,9462,None,1,5,4.0
8170,2014-07-29.20:34:50,Wrong Paths for distutils build --plat-name=win-amd64,68,4555,1,5,9.0
8171,2014-07-29.20:31:29,bdist_wininst builds wrongly for --plat-name=win-amd64,68,7641,1,5,3.0
21710,2014-07-29.20:24:28,--install-base option ignored?,2040,None,1,5,2.0
11212,2014-07-29.13:28:32,Python memory limit on AIX,2630,None,1,None,17.0
21946,2014-07-28.22:09:42,'python -u' yields trailing carriage return '\r'  (Python2 for Windows),19880,None,1,5,6.0
4264,2014-07-28.21:05:31,Patch: optimize code to use LIST_APPEND instead of calling list.append,9415,None,1,6,9.0
12970,2014-07-28.14:16:38,os.walk() consider some symlinks as dirs instead of non-dirs,13573,12260,1,6,5.0
22093,2014-07-28.06:07:53,Compiling python on OS X gives warning about compact unwind,17937,None,1,None,2.0
10964,2014-07-26.09:47:46,Mac installer need not add things to /usr/local,643,925,1,6,3.0
22045,2014-07-25.19:23:45,Python make issue,19934,None,1,5,1.0
22070,2014-07-25.17:01:30,Use the _functools module to speed up functools.total_ordering,1309,None,1,7,3.0
13533,2014-07-24.22:28:54,Would like Py_Initialize to play friendly with host app,15231,None,1,6,4.0
18605,2014-07-23.23:32:53,2.7: test_threading hangs on Solaris 9,13729,None,1,2,6.0
18355,2014-07-23.08:41:47,Merge super() guide into documentation,18082,114,1,6,3.0
22025,2014-07-22.16:54:28,webbrowser.get(command_line) does not support Windows-style path separators,19914,None,1,5,2.0
21964,2014-07-21.20:12:38,inconsistency in list-generator comprehension with yield(-from),19877,None,1,5,5.0
22013,2014-07-21.15:46:42,Add at least minimal support for thread groups,114,None,1,6,8.0
16748,2014-07-21.14:26:35,Make CPython test package discoverable,15467,7047,1,5,49.0
17695,2014-07-21.09:36:01,_sysconfigdata broken with universal builds on OSX,925,None,1,5,3.0
22011,2014-07-20.19:10:47,test_os extended attribute setxattr tests can fail with ENOSPC (Errno 28),19918,None,1,None,4.0
1047397,2014-07-20.06:39:30,cgitb failures,68,None,1,5,7.0
15305,2014-07-19.23:57:52,Test harness unnecessarily disambiguating twice,12075,None,1,6,11.0
15106,2014-07-19.23:05:11,Potential Bug in errors.c,16142,None,1,5,2.0
9399,2014-07-19.22:17:11,Provide a 'print' action for argparse,12734,2074,1,6,14.0
16446,2014-07-19.21:24:34,pdb raises BdbQuit on 'quit' when started with set_trace,12652,None,1,5,8.0
11001,2014-07-19.02:32:35,Various obvious errors in cookies documentation,12973,12260,1,None,4.0
644744,2014-07-18.21:52:35,bdist_rpm fails when installing man pages,181,7641,1,5,14.0
818201,2014-07-18.21:51:10,distutils: clean does not use build_base option from build,398,7641,1,5,6.0
20297,2014-07-18.16:46:17,concurrent.futures.as_completed() installs waiters for already completed Futures,18877,None,1,7,7.0
20369,2014-07-18.16:45:55,concurrent.futures.wait() blocks forever when given duplicate Futures,18877,None,1,None,4.0
21950,2014-07-18.15:47:44,import sqlite3 not running after configure --prefix=/alt/path; make; make install,19883,None,1,None,15.0
17185,2014-07-18.10:16:47,unittest mock create_autospec doesn't correctly replace mocksignature,4165,9716,1,5,3.0
17127,2014-07-18.00:22:25,multiprocessing.dummy.Pool does not accept maxtasksperchild argument,17251,None,1,5,4.0
17362,2014-07-17.23:56:49,enable-new-dtags only for GNU ELF linker,9108,None,1,2,2.0
17113,2014-07-17.22:53:23,argparse.RawDescriptionHelpFormatter should not delete blank lines,1266,None,1,5,4.0
17274,2014-07-17.22:25:12,distutils silently omits relative symlinks,13486,7641,1,5,2.0
15485,2014-07-17.19:37:28,CROSS: append gcc library search paths,9108,None,1,5,2.0
13819,2014-07-17.19:24:53,_warnings settings are process-wide,2040,None,1,5,2.0
16892,2014-07-17.15:42:08,Windows bug picking up stdin from a pipe,17113,None,1,5,3.0
15617,2014-07-17.14:22:18,FAIL: test_create_connection (test.test_socket.NetworkConnectionNoServer),3940,None,1,5,18.0
13837,2014-07-17.13:58:31,test_shutil fails with symlinks enabled under Windows,2040,None,1,5,7.0
15411,2014-07-17.13:58:18,os.chmod() does not follow symlinks on Windows,940,None,1,6,3.0
15629,2014-07-17.12:08:39,Add to regrtest the ability to run Lib and Doc doctests,12075,12260,1,6,36.0
7247,2014-07-17.11:58:42,test_fcntl_64_bit from test_fcntl.py fails in Python 2.6.4,11412,None,1,5,9.0
17243,2014-07-17.08:34:54,The changes made for issue 4074 should be documented,9663,12260,1,6,3.0
17101,2014-07-17.02:49:53,__main__.py Multiprocessing on Windows,17232,None,1,5,2.0
14689,2014-07-16.22:19:56,make PYTHONWARNINGS variable work in libpython,11313,None,1,6,2.0
17480,2014-07-16.19:46:42,pyvenv should be installed someplace more obvious on Windows,1290,None,1,6,8.0
17924,2014-07-16.19:44:04,Deprecate stat.S_IF* integer constants,3108,12260,1,5,2.0
15119,2014-07-16.19:30:20,ctypes mixed-types bitfield layout nonsensical; doesn't match compiler.,1118,None,1,5,9.0
21927,2014-07-16.17:43:08,BOM appears in stdin when using Powershell,1290,None,1,5,14.0
17026,2014-07-16.17:40:16,pdb frames accessible after the termination occurs on uncaught exception,12652,None,1,5,2.0
10048,2014-07-16.17:37:50,urllib.request documentation confusing,2040,1741,1,6,2.0
16965,2014-07-16.15:52:13,2to3 should rewrite execfile() to open in 'rb' mode,19,None,1,5,2.0
14149,2014-07-16.15:38:34,argparse: Document how to use argument names that are not Python identifiers,15564,12260,1,5,6.0
10991,2014-07-16.15:20:40,trace fails when test imported a temporary file,37,None,1,5,2.0
13923,2014-07-16.14:30:19,new formatter for argparse,15431,None,1,6,3.0
13023,2014-07-16.13:09:35,argparse should allow displaying argument default values in addition to setting a formatter class,10531,None,1,6,4.0
12800,2014-07-16.04:53:36,'tarfile.StreamError: seeking backwards is not allowed' when extract symlink,14755,1578,1,5,4.0
16729,2014-07-16.04:29:50,Document how to provide defaults for setup.py commands options,2984,7641,1,None,3.0
16878,2014-07-15.23:53:48,argparse: positional args with nargs='*' defaults to [],12075,None,1,5,10.0
17250,2014-07-15.23:51:21,argparse: Issue 15906 patch; positional with nargs='*' and string default,14858,None,1,5,3.0
16807,2014-07-15.23:44:32,argparse group nesting lost on inheritance,17070,None,1,5,4.0
9341,2014-07-15.22:52:41,allow argparse subcommands to be grouped,2074,None,1,6,3.0
9699,2014-07-15.21:56:51,invalid call of Windows API _popen() generating The input	line is too long error message,10073,3951,1,5,9.0
12480,2014-07-15.21:54:12,"urllib2 doesn't use proxy (fieddler2), configed the proxy with ProxyHandler",14528,1741,1,None,5.0
17783,2014-07-15.17:58:38,run the testsuite in batched mode,169,None,1,6,2.0
16663,2014-07-15.17:02:27,Poor documentation for METH_KEYWORDS,16982,12260,1,None,2.0
16652,2014-07-15.17:00:41,socket.getfqdn docs are not explicit enough about the algorithm.,9663,12260,1,5,2.0
18016,2014-07-15.16:15:14,subprocess should open stdin in mode w+b on windows,12307,None,1,5,3.0
16242,2014-07-15.15:07:00,Pickle and __getattr__,16698,12260,1,5,2.0
16185,2014-07-15.13:28:38,include path in subprocess.Popen() file not found error messages on Windows,12075,None,1,6,2.0
14730,2014-07-15.12:44:15,Implementation of the PEP 419: Protecting cleanup statements from interruptions,15933,None,1,6,2.0
20117,2014-07-15.01:24:42,subprocess on Windows: wrong return code with shell=True,5,None,1,5,3.0
18397,2014-07-14.21:33:02,Python with MinGW,18024,None,1,6,11.0
15552,2014-07-14.20:45:38,"gettext: if looking for .mo in default locations, also look in locale-bundle location",11998,None,1,None,2.0
14379,2014-07-14.20:28:00,Several traceback docs improvements,2984,12260,1,6,2.0
2698,2014-07-14.19:14:32,Extension module build fails for MinGW: missing vcvarsall.bat,1673,4555,1,2,44.0
21956,2014-07-14.17:21:41,Doc files deleted from repo are not deleted from docs.python.org.,11803,12260,1,None,9.0
15388,2014-07-13.21:20:59,SAX parse (ExpatParser) leaks file handle when given filename input,16284,None,1,3,2.0
15947,2014-07-13.21:17:33,Assigning new values to instance of pointer types does not check validity,204,None,1,5,2.0
15266,2014-07-13.20:20:15,Perform the same checks as PyPI for Description field,12075,None,1,5,6.0
16376,2014-07-13.14:48:39,wrong type for wintypes.BYTE,2984,None,1,5,2.0
16070,2014-07-13.14:17:27,"Structure and native Structure (LittleEndianStructure on Windows) supports __slots__, but BigEndianStructure doesn't",16280,None,1,5,2.0
5773,2014-07-13.12:51:42,Crash on shutdown after os.fdopen(2) in debug builds,1076,2217,1,None,9.0
8526,2014-07-13.12:04:01,msilib doesn't support multiple CAB instances in same installer,1360,None,1,6,7.0
7405,2014-07-13.12:01:32,compiling python 3.1.1 using cygwin 1.7.0 and gcc 4.3.4,9672,None,1,None,2.0
21969,2014-07-13.04:24:06,WindowsPath constructor does not check for invalid characters,16370,None,1,None,3.0
10837,2014-07-12.22:13:49,Issue catching KeyboardInterrupt while reading stdin,13561,None,1,5,4.0
5248,2014-07-12.20:08:31,Adding T_SIZET to structmember.h,1857,None,1,6,6.0
7976,2014-07-12.18:59:18,warnings should provide a public API for accessing its option parsing code,11889,None,1,6,18.0
21967,2014-07-12.16:31:09,Interpreter crash upon accessing frame.f_restricted of a frame from a dead thread,17652,None,1,1,1.0
