id,activity,title,creator,assignee,status,type,message_count
31984,2017-11-09.00:03:12,startswith and endswith leak implementation details,16076,None,1,5,8.0
10598,2017-11-08.23:10:20,Add test for curses haskey replacement,11450,15623,1,6,7.0
31986,2017-11-08.22:20:43,[2.7] test_urllib2net.test_sites_no_connection_close() randomly fails on Python 2.7,2377,None,1,None,1.0
31982,2017-11-08.20:50:58,8.3. collections — Container datatypes,27337,114,1,None,3.0
6412,2017-11-08.20:08:20,Titlecase as defined in Unicode Case Mappings not followed,6492,None,1,5,14.0
31879,2017-11-08.16:55:53,"Launcher fails on custom command starting with ""python""",26063,None,1,5,4.0
11253,2017-11-08.15:17:57,Document ctypes.wintypes constants,2984,12260,1,6,6.0
7938,2017-11-08.13:26:11,makesetup interprets macros -DA=B as a Make variable definition,11850,None,1,2,4.0
25862,2017-11-07.23:42:06,TextIOWrapper assertion failure after read() and SEEK_CUR,14751,None,1,1,1.0
31486,2017-11-07.22:35:54,calling a _json.Encoder object raises a SystemError in case obj.items() returned a tuple,23216,None,1,5,5.0
31951,2017-11-07.20:17:14,import curses is broken on windows,27319,None,1,None,6.0
31425,2017-11-07.18:49:59,Expose AF_QIPCRTR in socket module,26947,3108,1,6,1.0
31968,2017-11-07.13:30:00,exec(): method's default arguments from dict-inherited globals,27324,12260,1,5,2.0
31962,2017-11-06.20:58:04,test_importlib double free or corruption,27327,None,1,1,1.0
28708,2017-11-06.19:48:06,Low FD_SETSIZE limit on Windows,23448,None,1,3,5.0
28643,2017-11-06.17:38:43,Broken makefile depends for profile-opt target,83,None,1,6,5.0
31925,2017-11-06.17:05:57,[NetBSD] test_socket creates too many locks,15623,None,1,5,2.0
31939,2017-11-06.16:59:38,Support return annotation in signature for Argument Clinic,2377,None,1,6,11.0
31935,2017-11-06.16:52:32,subprocess.run() timeout not working with grandchildren and stdout=PIPE,24195,None,1,5,2.0
28140,2017-11-06.16:24:33,Attempt to give better errors for pip commands typed into the REPL,1309,None,1,6,3.0
31958,2017-11-06.15:45:00,UUID versions are not validated to lie in the documented range,21038,None,1,None,2.0
30699,2017-11-06.13:47:34,Misleading class names in datetime.tzinfo usage examples,17684,12260,1,6,1.0
23670,2017-11-06.10:37:48,Modifications to support iOS as a cross-compilation target,12020,5248,1,6,28.0
29659,2017-11-06.10:11:21,Expose the `length` arg from shutil.copyfileobj for public use,25668,None,1,6,4.0
30434,2017-11-06.07:10:12,"multiprocessing AuthenticationError ""digest sent was rejected""",26190,None,1,5,3.0
30548,2017-11-05.19:07:21,typo in documentation for create_autospec,26279,12260,1,6,2.0
31863,2017-11-05.17:44:11,Inconsistent returncode/exitcode for terminated child processes on Windows,27252,None,1,5,9.0
28994,2017-11-05.09:27:53,Misc fixes and cleanups in error handling C code,15623,None,1,5,12.0
30744,2017-11-05.05:55:41,Local variable assignment is broken when combined with threads + tracing + closures,9811,1309,1,None,48.0
31946,2017-11-04.22:55:29,mailbox.MH.add loses status info from other formats,17240,None,1,5,1.0
31546,2017-11-04.21:41:03,PyOS_InputHook is not called when waiting for input() in Windows,27020,None,1,5,8.0
26467,2017-11-04.17:45:18,Add async magic method support to unittest.mock.Mock,37,None,1,6,6.0
31604,2017-11-04.09:25:27,unittest.TestLoader().loadTestsFromTestCase(...) fails when adding test cases with the expectedFailure decorator,27056,None,1,1,2.0
31887,2017-11-04.06:23:55,docs for email.generator are missing a comment on special multipart/signed handling,21390,None,1,6,2.0
31898,2017-11-04.03:24:12,Add a `recommended-packages.txt` file,1309,1309,1,6,5.0
20182,2017-11-03.21:59:53,Derby #13: Convert 50 sites to Argument Clinic across 5 files,2731,None,1,6,37.0
31914,2017-11-03.19:29:34,Document Pool.(star)map return type,13838,12260,1,6,3.0
30844,2017-11-03.13:14:42,selectors: Add urgent data to read event,26510,None,1,6,22.0
22281,2017-11-02.23:56:22,ProcessPoolExecutor/ThreadPoolExecutor should provide introspection APIs,19914,None,1,6,4.0
30512,2017-11-02.16:37:13,CAN Socket support for NetBSD,11359,15623,1,6,2.0
23644,2017-11-02.15:34:54,g++ module compile fails with ‘_Atomic’ does not name a type,19531,None,1,None,32.0
3949,2017-11-02.11:42:38,curses' sigwinch handler isn't visible from python,7291,None,1,5,4.0
1553375,2017-11-02.11:17:48,Add traceback.print_full_exception(),1182,None,1,6,39.0
31922,2017-11-02.10:51:16,Can't receive replies from multicast UDP with asyncio,18005,None,1,5,1.0
18304,2017-11-02.08:33:30,ElementTree -- provide a way to ignore namespace in tags and searches,18053,None,1,6,16.0
31913,2017-11-01.23:22:22,forkserver could warn if several threads are running,2040,None,1,6,3.0
5368,2017-11-01.18:55:37,"curses patch add color_set and wcolor_set , and addchstr family of functions",10141,15623,1,6,10.0
1751519,2017-11-01.18:52:54,curses - new window methods: addchstr and addchnstr,3811,15623,1,6,5.0
1723038,2017-11-01.18:03:59,Curses Menu,3795,15623,1,6,4.0
3786,2017-11-01.17:54:25,"_curses, _curses_panel & _multiprocessing can't be build in 2.6b3 w/ SunStudio 12",9192,None,1,2,16.0
31412,2017-11-01.09:01:18,wave.open does not accept PathLike objects,23340,None,1,6,2.0
31916,2017-11-01.05:13:18,ensurepip not honoring value of $(DESTDIR) - pip not installed,27294,None,1,5,2.0
18534,2017-11-01.03:14:32,"State clearly that open() 'file' param is ""name"" attr of the result",1309,12260,1,None,6.0
31844,2017-10-31.20:02:42,HTMLParser: undocumented not implemented method,618,None,1,5,4.0
31739,2017-10-30.23:28:15,socket.close recommended but not demonstrated in same-page example code,22682,24191,1,6,7.0
31903,2017-10-30.19:59:15,`_scproxy` calls SystemConfiguration functions in a way that can cause deadlocks,20888,None,1,1,1.0
31114,2017-10-30.19:56:20,'make install' fails when the configure 'prefix' is '/' and DESTDIR is used,12652,None,1,5,5.0
29515,2017-10-30.17:24:15,"socket module missing IPPROTO_IPV6, IPPROTO_IPV4 on Windows",25501,None,1,5,4.0
29205,2017-10-30.16:38:34,col_offset for AsyncFunctionDef AST nodes is wrong,22444,None,1,None,2.0
31902,2017-10-30.16:33:50,"Fix col_offset for ast nodes: AsyncFor, AsyncFunctionDef, AsyncWith",23547,None,1,None,None
31899,2017-10-30.05:23:17,Ensure backwards compatibility with recommended packages,1309,1309,1,6,1.0
31894,2017-10-30.01:54:59,test_timestamp_naive failed on NetBSD,15623,None,1,5,9.0
31749,2017-10-29.11:23:36,Request: Human readable byte amounts in the standard library,27152,None,1,6,10.0
31886,2017-10-29.11:02:09,Multiprocessing.Pool hangs after re-spawning several worker process.,27273,None,1,5,2.0
20479,2017-10-29.02:23:26,Efficiently support weight/frequency mappings in the statistics module,1309,9511,1,6,9.0
19891,2017-10-28.14:13:09,Exiting Python REPL prompt with user without home directory throws error in atexit._run_exitfuncs,17937,None,1,5,10.0
1243730,2017-10-28.12:23:16,Big speedup in email message parsing,609,None,3,7,5.0
31775,2017-10-28.12:09:57,Support unbuffered TextIOWrapper,2377,None,3,None,7.0
17418,2017-10-28.12:06:46,Documentation links for io.open,17472,12260,3,None,6.0
31871,2017-10-28.09:49:54,Support for file descriptor params in os.path,27262,12260,1,6,3.0
13657,2017-10-28.01:38:37,IDLE doesn't recognize resetting sys.ps1.,14620,155,1,6,16.0
18670,2017-10-27.22:09:33,Using read_mime_types function from mimetypes module gives resource warning,17937,None,1,3,5.0
4032,2017-10-27.16:50:33,"distutils doesn't search "".dll.a"" as library on cygwin",2529,4555,1,5,8.0
31885,2017-10-27.14:59:26,Cygwin: socket test suites hang indefinitely due to bug in Cygwin,13967,None,1,1,1.0
31882,2017-10-27.13:12:33,Cygwin: asyncio and asyncore test suites hang indefinitely due to bug in Cygwin,13967,None,1,1,1.0
31878,2017-10-27.10:02:49,Cygwin: _socket module does not compile due to missing ioctl declaration,13967,None,1,2,1.0
25729,2017-10-26.20:51:56,update pure python datetime.timedelta creation,17420,1427,1,6,10.0
31873,2017-10-26.15:55:51,Inconsistent capitalization of proper noun - Unicode.,27218,12260,1,6,5.0
31828,2017-10-26.15:52:49,Support Py_tss_NEEDS_INIT outside of static initialisation,2153,None,1,6,4.0
2445,2017-10-26.15:31:27,Use The CygwinCCompiler Under Cygwin,2528,4555,1,2,14.0
31876,2017-10-26.14:21:36,python363.chm includes gibberish,27265,12260,1,5,1.0
31874,2017-10-26.14:07:58,[feature] runpy.run_module should mimic script launch behavior for sys.path,1290,None,1,6,2.0
16737,2017-10-26.14:01:54,Different behaviours in script run directly and via runpy.run_module,328,None,1,5,19.0
24954,2017-10-26.00:18:34,No way to generate or parse timezone as produced by datetime.isoformat(),5,1427,1,6,23.0
17942,2017-10-25.20:12:23,IDLE Debugger: Improve GUI,155,155,1,6,10.0
15335,2017-10-25.19:28:41,IDLE - debugger steps into print and over rpc.py code,7276,155,1,5,8.0
25083,2017-10-25.15:49:20,Python can sometimes create incorrect .pyc files,22446,None,1,5,23.0
24564,2017-10-25.09:23:44,shutil.copytree fails when copying NFS to NFS,22076,None,1,1,6.0
31865,2017-10-25.02:46:46,html.unescape does not work as per documentation,27257,12260,1,5,1.0
30768,2017-10-25.00:15:14,PyThread_acquire_lock_timed() should recompute the timeout when interrupted by a signal,2377,None,1,None,10.0
25172,2017-10-24.20:55:02,Unix-only crypt should not be present on Windows.,155,None,1,5,1.0
9305,2017-10-24.18:38:20,Don't use east/west of UTC in date/time documentation,1427,None,1,6,21.0
31862,2017-10-24.15:18:34,Port the standard library to PEP 489 multiphase initialization,26155,None,1,6,2.0
31859,2017-10-24.12:13:37,sharedctypes.RawArray initialization,27249,None,1,5,1.0
14465,2017-10-24.08:46:06,xml.etree.ElementTree: add feature to prettify XML output,13754,15623,1,6,10.0
27141,2017-10-24.07:08:38,Fix collections.UserList shallow copy,22467,15623,1,5,15.0
31855,2017-10-24.04:32:25,mock_open is not compatible with read(n) (and pickle.load),27241,9716,1,5,2.0
29202,2017-10-24.03:20:17,Improve dict iteration,114,15623,1,7,8.0
2651,2017-10-23.23:37:04,Strings passed to KeyError do not round trip,4934,12704,1,5,27.0
25041,2017-10-23.17:56:55,document AF_PACKET socket address format,19896,12260,1,6,7.0
31850,2017-10-23.17:53:07,"test_nntplib failed with ""nntplib.NNTPDataError: line too long""",2377,None,1,None,2.0
31826,2017-10-23.17:04:40,Misleading __version__ attribute of modules in standard library,20211,None,1,5,6.0
28660,2017-10-23.13:49:01,"TextWrapper break_long_words=True, break_on_hyphens=True on long words",12698,None,1,5,2.0
31846,2017-10-23.12:46:04,Error in 3.6.3 epub docs,19848,None,1,None,1.0
28143,2017-10-23.10:58:51,ASDL compatibility with Python 3 system interpreter,16536,None,1,2,14.0
31842,2017-10-22.21:31:34,"pathlib: ""Incorrect function"" during resolve()",27232,None,1,None,1.0
9842,2017-10-22.21:18:50,Document ... used in recursive repr of containers,7641,12260,1,None,3.0
28286,2017-10-22.20:19:14,gzip guessing of mode is ambiguous,15623,None,1,6,5.0
28224,2017-10-22.15:26:19,Compilation warnings on Windows: export 'PyInit_xx' specified multiple times,2377,None,1,None,5.0
31839,2017-10-22.12:20:02,datetime: add method to parse isoformat() output,8944,None,1,6,1.0
31815,2017-10-22.09:13:17,Make itertools iterators interruptible,15623,114,1,6,12.0
24567,2017-10-22.08:14:32,random.choice IndexError due to double-rounding,9511,114,1,5,44.0
28022,2017-10-22.07:59:05,SSL releated deprecation for 3.6,3108,3108,1,4,28.0
16700,2017-10-22.07:52:54,Document that bytes OS API can returns unusable results on Windows,15623,12260,1,6,7.0
27640,2017-10-21.20:11:36,add the '--disable-test-suite' option to configure,12652,None,1,6,6.0
28655,2017-10-21.17:22:48,Tests altered the execution environment in isolated mode,15623,None,1,5,2.0
31837,2017-10-21.17:08:02,ParseError in test_all_project_files(),15623,None,1,5,1.0
30156,2017-10-21.16:15:08,PYTHONDUMPREFS segfaults on exit,8944,None,1,1,10.0
31314,2017-10-21.09:38:16,email throws exception with oversized header input,169,None,1,None,5.0
31761,2017-10-20.20:46:32,Failures and crashes when running tests by import,26219,12260,1,5,14.0
31203,2017-10-20.19:40:30,socket.IP_PKTINFO is missing from python,26795,None,1,6,2.0
31794,2017-10-20.19:35:15,Issues with test.autotest,15623,None,1,5,2.0
31813,2017-10-20.18:56:03,python -m ensurepip hangs,27201,None,1,5,2.0
31798,2017-10-20.18:41:48,`site.abs__file__` fails for modules where `__file__` cannot be modified,27190,None,1,5,4.0
31783,2017-10-20.17:06:20,Race condition in ThreadPoolExecutor when scheduling new jobs while the interpreter shuts down,17868,None,1,5,1.0
31782,2017-10-20.17:05:24,Add a timeout to multiprocessing's Pool.join,27175,None,1,6,3.0
31818,2017-10-20.08:59:33,[macOS] _scproxy.get_proxies() crash -- get_proxies() is not fork-safe?,27207,None,1,1,8.0
31163,2017-10-20.00:27:58,Return destination path in Path.rename and Path.replace,26763,12260,1,6,2.0
14912,2017-10-19.09:34:19,Pdb does not stop at a breakpoint after a restart command and source changes,12652,None,1,5,4.0
31742,2017-10-18.19:43:36,Default to emitting FutureWarning for provisional APIs,1309,None,1,6,32.0
9253,2017-10-18.18:58:41,argparse: optional subparsers,12644,None,1,6,36.0
29696,2017-10-18.09:30:37,Use namedtuple in string.Formatter.parse iterator response,204,None,1,5,9.0
31753,2017-10-18.04:09:08,Unnecessary closure in ast.literal_eval,23232,None,1,7,10.0
21114,2017-10-17.19:50:19,wsgiref.simple_server doesn't handle multi-line headers correctly,19333,None,1,5,11.0
28700,2017-10-16.15:36:01,"test_dbm failure: KeyError: b'0' (intermittent in 3.5, reliable in 3.6)",44,None,1,5,6.0
31772,2017-10-16.09:50:57,SourceLoader uses stale bytecode in case of equal mtime seconds,27149,None,1,5,13.0
31791,2017-10-15.20:34:11,Ensure that all PyTypeObject fields are set to non-NULL defaults,27052,None,1,7,5.0
31789,2017-10-15.00:34:04,Better error message when failing to overload metaclass.mro,25661,None,1,6,1.0
17776,2017-10-14.21:33:05,IDLE Internationalization,17730,155,1,6,14.0
21263,2017-10-14.21:04:17,test_gdb failures on os x 10.9.2,19417,None,1,None,4.0
31758,2017-10-14.19:42:49,"various refleaks in _elementtree, and crashes when using an uninitialized XMLParser object",23216,None,1,1,3.0
9633,2017-10-14.09:52:54,pdb go stack up/down,12849,None,1,5,6.0
31779,2017-10-13.14:14:21,assertion failures and a crash when using an uninitialized struct.Struct object,23216,None,1,1,1.0
31777,2017-10-12.22:07:23,IDLE: Let users add to font selection,155,155,1,6,1.0
31767,2017-10-12.21:47:12,Windows Installer fails with error 0x80091007 when trying to install debugging symbols,18216,None,1,4,4.0
31768,2017-10-12.20:52:05,argparse drops '|'s when the arguments are too long,27166,None,1,5,8.0
31640,2017-10-12.19:19:21,Document exit() from parse_args,7266,12260,1,6,3.0
31771,2017-10-12.13:37:55,tkinter geometry string +- when window ovelaps left or top of screen,27168,12260,1,6,2.0
31769,2017-10-12.09:37:14,configure includes user CFLAGS when detecting pthreads support,15837,14,1,2,2.0
14369,2017-10-12.02:46:41,make __closure__ writable,12874,None,1,6,14.0
31327,2017-10-11.16:52:47,bug in dateutil\tz\tz.py,26892,12260,1,6,9.0
31751,2017-10-11.13:17:18,Support for C++ 11 and/or C++ 14 in python.org installer,11657,None,1,6,4.0
30821,2017-10-11.13:00:34,unittest.mock.Mocks with specs aren't aware of default arguments,25712,9716,1,None,7.0
1566331,2017-10-11.10:36:16,Bad behaviour in <ossaudio audio device>.obuf*,2831,44,1,5,4.0
31748,2017-10-11.09:30:09,"configure fails to detect fchdir() using CFLAGS=""-Werror -Wall""",13838,None,1,6,9.0
17088,2017-10-11.09:02:24,ElementTree incorrectly refuses to write attributes without namespaces when default_namespace is used,12316,None,1,5,11.0
31456,2017-10-11.04:06:24,SimpleCookie fails to parse any cookie if an entry has whitespace in the name,26964,None,1,5,3.0
17960,2017-10-11.02:16:40,Clarify the required behaviour of locals(),1309,1309,1,5,9.0
31746,2017-10-10.21:42:00,crashes in sqlite3.Connection in case it is uninitialized or partially initialized,23216,None,1,1,1.0
31750,2017-10-10.20:10:36,expose PyCell_Type in types module,27149,None,1,6,6.0
31722,2017-10-10.19:05:39,_io.IncrementalNewlineDecoder doesn't inherit codecs.IncrementalDecoder,15623,None,1,5,2.0
13601,2017-10-10.18:05:57,sys.stderr should be line-buffered when stderr is not a TTY,2040,None,1,5,14.0
31745,2017-10-10.14:08:15,"Overloading ""Py_GetPath"" does not work",12711,None,1,5,1.0
31743,2017-10-10.11:00:17,Proportional Width Font on Generated Python Docs PDFs,27146,12260,1,6,1.0
31735,2017-10-10.08:59:44,Documentation incorrectly states how descriptors are invoked,25888,12260,1,None,6.0
31608,2017-10-09.20:53:19,crash in methods of a subclass of _collections.deque with a bad __new__(),23216,114,1,1,3.0
31734,2017-10-09.20:04:48,crash or SystemError in sqlite3.Cache in case it is uninitialized or partially initialized,23216,None,1,1,2.0
31724,2017-10-09.19:56:10,test_xmlrpc_net should use something other than buildbot.python.org,15467,None,1,None,4.0
31737,2017-10-09.19:40:26,Documentation renders incorrectly,27140,12260,1,None,3.0
31092,2017-10-09.14:36:56,delicate behaviour of shared (managed) multiprocessing Queues,26699,None,1,5,9.0
31267,2017-10-09.09:33:52,threading.Timer object is affected by changes to system time: Python locks should use a monotonic clock if available,26851,None,1,5,6.0
31726,2017-10-09.07:49:48,Missing token.COMMENT,27002,None,1,6,8.0
31729,2017-10-08.21:48:28,multiprocesssing.pool.AsyncResult undocumented field,27137,None,1,6,1.0
31165,2017-10-07.18:18:17,list_slice() does crash if the list is mutated indirectly by PyList_New(),24426,None,1,1,12.0
31695,2017-10-07.15:45:09,Improve bigmem tests,15623,None,1,6,2.0
31718,2017-10-07.14:28:38,some methods of uninitialized io.IncrementalNewlineDecoder objects raise SystemError,23216,None,1,5,5.0
31713,2017-10-06.17:48:03,python3 python-config script generates invalid includes,27125,None,1,None,1.0
31717,2017-10-06.17:00:05,Socket documentation threading misstep?,27131,12260,1,None,4.0
31715,2017-10-06.15:27:13,Add mimetype for extension .mjs,27128,None,1,6,1.0
31710,2017-10-06.06:04:49,setup.py: _ctypes won't getbuilt when system ffi is only in $PREFIX,11779,None,1,2,2.0
31694,2017-10-05.15:07:43,Running Windows installer with LauncherOnly=1 should not register the version as installed,22605,16632,1,5,3.0
31704,2017-10-05.13:52:00,HTTP check lowercase response from proxy,27099,None,1,5,1.0
31684,2017-10-04.19:02:15,Scientific formatting of decimal 0 different from float 0,11883,None,1,None,7.0
31557,2017-10-04.17:21:19,tarfile: incorrectly treats regular file as directory,27031,None,1,5,5.0
31623,2017-10-04.16:37:05,Allow to build MSI installer from the official tarball,20235,None,1,6,7.0
28805,2017-10-04.15:19:37,Add documentation for METH_FASTCALL and _PyObject_FastCall*(),11089,12260,1,6,9.0
17446,2017-10-04.14:46:15,doctest test finder doesnt find line numbers of properties,14361,None,1,5,11.0
31686,2017-10-03.23:48:08,GZip library doesn't properly close files,27102,None,1,5,1.0
22729,2017-10-03.09:41:03,concurrent.futures `wait` and `as_completed` depend on private api,20276,None,1,5,8.0
22630,2017-10-03.09:40:04,`concurrent.futures.Future.set_running_or_notify_cancel` does not notify cancel,20276,12260,1,None,3.0
31660,2017-10-02.23:23:56,sys.executable different in os.execv'd python3.6 virtualenv session in python2 vs python3,27087,None,1,None,5.0
31665,2017-10-02.20:17:56,"Edit ""Setting [windows] environmental variables""",155,12260,1,5,2.0
29832,2017-10-02.15:09:14,Don't refer to getsockaddrarg in error messages,15623,None,1,6,4.0
31659,2017-10-02.09:56:16,ssl module should not use textwrap for wrapping PEM format.,10371,None,1,None,3.0
31654,2017-10-01.21:53:21,ctypes should support atomic operations,27082,None,1,6,14.0
31553,2017-10-01.15:52:50,Extend json.tool to handle jsonlines (with a flag),27028,24191,1,6,6.0
31465,2017-10-01.08:44:44,Allow _PyType_Lookup() to raise exceptions,2153,None,1,5,6.0
31652,2017-10-01.02:06:05,make install fails: no module _ctypes,27080,None,1,2,2.0
20464,2017-09-30.21:12:38,Update distutils sample config file in Doc/install/index.rst,15467,7641,1,5,1.0
28604,2017-09-30.19:24:02,Exception raised by python3.5 when using en_GB locale,24891,None,1,5,3.0
31601,2017-09-30.02:06:52,"Availability of utimensat, futimens not checked correctly on macOS",11099,None,1,1,2.0
31613,2017-09-30.01:07:17,Localize tkinter.simpledialog.Default buttons as with file dialogs.,24635,None,1,6,6.0
31594,2017-09-30.00:16:03,Make bytes and bytearray maketrans accept dictionaries as first argument as it's done in str,27051,None,1,5,6.0
31582,2017-09-29.21:19:25,Add _pth breadcrumb to sys.path documentation,27046,12260,1,6,2.0
30188,2017-09-29.15:51:55,test_nntplib: random EOFError in setUpClass(),2377,None,1,None,15.0
29843,2017-09-29.14:26:33,errors raised by ctypes.Array for invalid _length_ attribute,23216,None,1,5,12.0
31631,2017-09-29.09:45:23,test_c_locale_coercion fails on OpenBSD,15623,None,1,5,1.0
31635,2017-09-29.09:44:23,test_strptime failure on OpenBSD,15623,None,1,5,1.0
31636,2017-09-29.09:44:11,test_locale failure on OpenBSD,15623,None,1,5,1.0
31603,2017-09-29.05:31:58,Please add argument to override stdin/out/err in the input builtin,15431,None,1,None,5.0
29729,2017-09-28.20:43:09,"RFE: uuid.UUID(bytes=...): support bytes-like types, not only bytes",25725,None,1,6,8.0
25098,2017-09-28.15:21:44,test_uuid fails with pywin32 installed,15467,None,1,5,4.0
31610,2017-09-28.15:05:48,Use select.poll instead of select.select in SocketServer.BaseServer.serve_forever,27057,None,1,7,4.0
26793,2017-09-28.13:42:02,ctypes issue with threads after fork,23777,None,1,None,16.0
1350,2017-09-28.13:17:11,IDLE - CallTips enhancement - show full doc-string in new window,2557,155,1,6,12.0
22083,2017-09-28.07:00:49,Refactor PyShell's breakpoint related methods,18939,None,1,6,3.0
21696,2017-09-28.07:00:41,Idle: test configuration files,155,155,1,6,5.0
694339,2017-09-28.06:59:47,IDLE: Dedenting with Shift+Tab,1073,155,1,6,12.0
21787,2017-09-28.06:59:39,Idle: make 3.x  Hyperparser.get_expression recognize ...,155,155,1,6,1.0
11437,2017-09-28.06:58:52,IDLE crash on startup with typo in config-keys.cfg,13896,155,1,5,18.0
24412,2017-09-28.06:58:44,setUpClass equivalent for addCleanup,9663,None,1,6,14.0
6858,2017-09-28.06:58:13,IDLE: allow syntax highlighting of files without .py extension,11163,155,1,6,13.0
21880,2017-09-28.06:58:02,IDLE: Ability to run 3rd party code checkers,18939,155,1,6,9.0
17535,2017-09-28.06:57:37,"IDLE: Add an option to show line numbers along the left side of the editor window, and have it enabled by default.",12768,155,1,6,31.0
20827,2017-09-28.06:57:03,IDLE : Display function argument list in ClassBrowser,18939,None,1,6,10.0
15988,2017-09-28.06:45:38,Inconsistency in overflow error messages of integer argument,15623,15623,1,6,29.0
31422,2017-09-28.04:32:02,tkinter.messagebox and tkinter.filedialog don't show default button's keyboard shortcuts,24635,None,1,6,8.0
31552,2017-09-28.04:22:43,IDLE: Convert browswers to use ttk.Treeview,155,155,1,6,4.0
1649329,2017-09-27.21:43:24,Extract file-finding and language-handling code from gettext.find,3576,None,1,6,22.0
31531,2017-09-27.17:44:14,crash and SystemError in case of a bad zipimport._zip_directory_cache,23216,None,1,1,2.0
31612,2017-09-27.17:14:55,Building 3.6 fails on Windows,15623,None,1,2,9.0
25359,2017-09-27.17:05:13,io.open() fails to open ascii file if LANG env not set,22642,None,1,5,14.0
29442,2017-09-26.16:46:07,Replace optparse with argparse in setup.py,21917,None,1,6,19.0
17421,2017-09-26.07:50:01,Drop restriction that meta.__prepare__() must return a dict (subclass),14000,None,1,6,5.0
31577,2017-09-26.07:46:23,crash in os.utime() in case of a bad ns argument,23216,None,1,1,3.0
27163,2017-09-25.23:04:56,IDLE entry for What's New in Python 3.6,155,155,1,6,4.0
30755,2017-09-25.22:39:15,locale.normalize() and getdefaultlocale() convert C.UTF-8 to en_US.UTF-8,3421,None,1,None,4.0
16322,2017-09-25.15:53:06,time.tzname on Python 3.3.0 for Windows is decoded by wrong encoding,16629,None,1,5,22.0
31573,2017-09-25.14:03:54,PyStructSequence_New() doesn't validate its input type (crashes in os.wait3() and os.wait4() in case of a bad resource.struct_rusage),23216,None,1,1,2.0
25435,2017-09-25.08:18:42,Wrong function calls and referring to not removed concepts in descriptor HowTo (documentation),22697,114,1,None,11.0
27426,2017-09-25.07:07:35,Encoding mismatch causes some tests to fail on Windows,21927,None,1,5,1.0
31131,2017-09-25.03:16:32,asyncio.wait_for() TimeoutError doesn't provide full traceback,12075,None,1,5,2.0
30826,2017-09-24.19:59:24,More details in reference 'Looping through a list in Python and modifying it',26500,114,1,6,8.0
27268,2017-09-24.17:20:05,Incorrect error message on float(''),16557,None,1,5,8.0
31461,2017-09-23.23:13:22,IDLE: Enhance module browser,155,155,1,5,6.0
25090,2017-09-23.23:11:37,IDLE: remove noisy icons from class (module) browser,10882,155,1,6,5.0
31565,2017-09-23.22:54:56,open() doesn't use locale.getpreferredencoding(),15623,None,1,5,1.0
12425,2017-09-23.19:56:11,gettext breaks on empty plural-forms value,5277,None,1,5,5.0
31534,2017-09-22.20:37:40,python 3.6.2 installation failed 0x80070002 error,27008,None,1,None,2.0
21937,2017-09-22.18:32:43,IDLE interactive window doesn't display unsaved-indicator,114,None,1,5,5.0
31551,2017-09-22.10:39:31,test_distutils fails if current directory contains spaces,15623,None,1,5,1.0
31539,2017-09-21.21:47:26,asyncio.sleep may sleep less time then it should,27014,None,1,5,13.0
